{
  "$schema": "https://json-schema.org/draft/2020-12/schema",
  "$id": "https://github.com/blotquant/schema/result.schema.json",
  "title": "blotquant analysis result",
  "description": "One file per analysed image, written by the pipeline. This schema is the source of truth for the result contract. Every reported number is traceable to an ROI, a parameter set and a software version, and every value carries its QC flags rather than being dropped. Version 1.1.0 is the first version a produced document validates against: Phase 2 added the unresolved_shoulder band flag, the warnings that name which flag a normalization reference carries, the per-ratio reference-flagged record, the multi-reference denominator list, and the qc parameter block. Version 1.2.0 adds the required lanes[].roi_source, because lanes may now be supplied by the caller instead of detected and the document must say which. Version 1.3.0 adds the optional source.channel_collapse, recording that a multi-channel input was collapsed to one channel on the way in and by which ruled method and measured divergence, and the optional normalization.reference_designation_source, recording where the caller's reference designation came from. Both are optional because their absence is itself a record -- the file was already single-channel, the designation's origin was not stated -- so no earlier writer becomes wrong; the version still moves because source and normalization are both additionalProperties: false and a 1.2.0 validator rejects a 1.3.0 document outright. All edits additive; NOTES.md records each one and its reason.",
  "type": "object",
  "additionalProperties": false,
  "required": [
    "schema_version",
    "result_id",
    "source",
    "provenance",
    "lanes",
    "bands",
    "normalization",
    "image_qc_flags"
  ],
  "properties": {
    "schema_version": {
      "type": "string",
      "pattern": "^[0-9]+\\.[0-9]+\\.[0-9]+$",
      "const": "1.4.0",
      "description": "The version of this contract the document was written against. A const, mirroring ground_truth.schema.json, so the schema file and pipeline.RESULT_SCHEMA_VERSION cannot drift apart; tests/test_schema.py pins the two together."
    },
    "result_id": { "type": "string", "minLength": 1 },
    "source": {
      "type": "object",
      "additionalProperties": false,
      "required": [
        "path",
        "image_format",
        "bit_depth",
        "width_px",
        "height_px",
        "lossy_format",
        "polarity"
      ],
      "description": "The input as loaded. bit_depth is what the file declared; unsupported depths raise instead of being squashed.",
      "properties": {
        "path": { "type": "string", "minLength": 1 },
        "sha256": { "$ref": "#/$defs/sha256" },
        "image_format": { "enum": ["tiff", "png", "jpeg"] },
        "bit_depth": { "enum": [8, 16] },
        "max_value": { "enum": [255, 65535] },
        "width_px": { "type": "integer", "minimum": 1 },
        "height_px": { "type": "integer", "minimum": 1 },
        "lossy_format": { "type": "boolean" },
        "polarity": {
          "type": "string",
          "enum": ["bright_on_dark", "dark_on_bright"],
          "description": "The signal polarity the caller declared for this file: bright_on_dark when bands are brighter than their background, dark_on_bright when they are darker. Declared, never inferred (2026-08-24 polarity amendment, ruling (a)); the pipeline refuses an undeclared image rather than guessing. An enum rather than a free string, so a document asserting a polarity the amendment does not define fails validation instead of being read as a third convention. Recorded as DECLARED, not as applied: a dark_on_bright document says so although its pixels were inverted to the canonical convention on the way in, because the declaration describes the file and the inversion describes the run."
        },
        "channel_collapse": {
          "type": "object",
          "additionalProperties": false,
          "required": ["method", "max_divergence_dn"],
          "description": "Present only when a multi-channel input was collapsed to one channel on the way in, per the ratified 2026-08-19 §7 amendment (data/real/AMENDMENT_2026-08-19_channel_collapse.md). Absent means the file was already single-channel: a document that carries this block had a multi-channel file behind it, and one that does not, did not. Never emitted as null, which would say a collapse was considered and declined.",
          "properties": {
            "method": {
              "const": "green",
              "description": "The collapse method, fixed by the amendment's ruling (b) and not selectable. A const, so a document recording any other method fails validation rather than being read as a permitted variant."
            },
            "max_divergence_dn": {
              "type": "integer",
              "minimum": 0,
              "maximum": 2,
              "description": "Maximum over pixels of max(|R-G|, |R-B|, |G-B|), in DN of an 8-bit full scale, as measured on the input. Bounded at the ruled 2 DN: a document claiming a collapse above the bound is not a document this pipeline can have written. Recorded even when 0, because the amendment's stated purpose for it is that a reader can see how close to the bound that image sat."
            }
          }
        },
        "ground_truth_image_id": {
          "type": "string",
          "minLength": 1,
          "description": "Set only when the input came from the synthetic gold set; used by evals to join results to ground truth."
        }
      }
    },
    "provenance": {
      "type": "object",
      "additionalProperties": false,
      "required": ["software_version", "config_id", "config_digest", "parameters", "created_at"],
      "description": "Everything needed to reproduce this result. `parameters` is the complete, explicit processing config; no parameter used by the pipeline may be absent from it.",
      "properties": {
        "software_version": { "type": "string", "minLength": 1 },
        "config_id": { "type": "string", "minLength": 1 },
        "config_digest": { "$ref": "#/$defs/sha256" },
        "created_at": { "type": "string", "format": "date-time" },
        "parameters": {
          "type": "object",
          "required": ["background", "detection", "quantification", "qc", "normalization"],
          "description": "Echo of the processing config. Sub-objects stay open because the pipeline owns their exact keys, but every stage must be present and each processing stage must name its method explicitly. Completeness of the echo is enforced by pipeline.config, which accepts a config only when it carries exactly the keys the pipeline reads.",
          "properties": {
            "background": {
              "type": "object",
              "required": ["method"],
              "properties": {
                "method": {
                  "enum": ["rolling_ball", "local_median"],
                  "description": "Required and explicit; there is no default background method."
                }
              }
            },
            "detection": { "type": "object", "required": ["method"] },
            "quantification": { "type": "object", "required": ["method"] },
            "qc": {
              "type": "object",
              "description": "Echo of the QC thresholds. Open like the other stages: the pipeline owns the key names, and each threshold's independent justification is recorded in NOTES.md rather than in this contract."
            },
            "normalization": {
              "type": "object",
              "required": ["mode", "exclude_qc_flagged"],
              "properties": {
                "mode": { "$ref": "#/$defs/normalization_mode" },
                "exclude_qc_flagged": {
                  "type": "boolean",
                  "description": "True by default; setting it false is an explicit, recorded override."
                }
              }
            }
          }
        }
      }
    },
    "lanes": {
      "type": "array",
      "items": {
        "type": "object",
        "additionalProperties": false,
        "required": ["lane_id", "roi", "roi_source"],
        "properties": {
          "lane_id": { "type": "string", "minLength": 1 },
          "lane_index": { "type": "integer", "minimum": 0 },
          "roi": { "$ref": "#/$defs/roi" },
          "roi_source": {
            "enum": ["detected", "caller"],
            "description": "Where this lane rectangle came from: `detected` means the pipeline located it from the image's own column profile, `caller` means the caller supplied it and lane detection did not run for this image. Required, and emitted on every lane whatever its value, because an absent value would be indistinguishable from a writer that does not record it -- and a document that reported a caller-chosen region as a detector output would be a false provenance record. Band detection inside a caller-supplied lane is the same code with the same parameters, so this field describes the lane's boundary only, not how its bands were found."
          },
          "total_protein_signal": {
            "type": "number",
            "description": "The sum of the background-corrected pixels inside this lane's ROI, in DN of the source bit depth -- the denominator total_protein normalization divides by, and present only when that mode was used. Not a mean-column-profile integral: it is an ROI pixel sum, which is the profile integral multiplied by the lane's width, so the two differ between lanes of unequal width. The pixel sum is the comparable quantity, because a band's integrated_intensity is a pixel sum over the same image."
          },
          "qc_flags": { "$ref": "#/$defs/band_qc_flags" }
        }
      }
    },
    "bands": {
      "type": "array",
      "items": {
        "type": "object",
        "additionalProperties": false,
        "required": [
          "band_id",
          "lane_id",
          "roi",
          "integrated_intensity",
          "background_estimate",
          "qc_flags",
          "excluded_from_normalization"
        ],
        "properties": {
          "band_id": { "type": "string", "minLength": 1 },
          "lane_id": { "type": "string", "minLength": 1 },
          "roi": { "$ref": "#/$defs/roi" },
          "integrated_intensity": {
            "type": "number",
            "description": "Background-corrected integrated intensity over the ROI, in DN of the source bit depth."
          },
          "background_estimate": { "type": "number" },
          "peak_value": {
            "type": "number",
            "description": "The brightest background-corrected pixel inside the ROI, in DN of the source bit depth -- the same units as integrated_intensity. The image-level low_dynamic_range flag is decided on the largest of these."
          },
          "clipped_pixel_count": {
            "type": "integer",
            "minimum": 0,
            "description": "How many pixels inside the ROI sit at full scale in the image as loaded. Full scale is the only observable definition of clipping: a pixel reading max_value is indistinguishable from one truncated there."
          },
          "row_half_width_ratio": {
            "type": ["number", "null"],
            "minimum": 1,
            "description": "The observation the unresolved_shoulder flag is decided on: the wider of this peak's two half-widths in its lane's row profile divided by the narrower, measured at qc.shoulder_half_maximum_fraction of the peak's height. 1.0 for a symmetric single peak. Explicitly null when the statistic was censored -- the profile did not reach that level on both sides within the bounds this peak was measured in -- which is not the same as symmetric, and never flags. Recorded beside the flag for the same reason clipped_pixel_count is: a reader can re-apply any threshold to the number the decision was made on."
          },
          "qc_flags": { "$ref": "#/$defs/band_qc_flags" },
          "excluded_from_normalization": {
            "type": "boolean",
            "description": "QC annotates, never silently drops: a flagged band still reports its value here, and its exclusion is explicit."
          },
          "exclusion_reason": { "type": "string", "minLength": 1 }
        },
        "allOf": [
          {
            "if": { "properties": { "excluded_from_normalization": { "const": true } } },
            "then": { "required": ["exclusion_reason"] }
          }
        ]
      }
    },
    "normalization": {
      "type": "object",
      "additionalProperties": false,
      "required": ["mode", "exclude_qc_flagged", "warnings", "ratios"],
      "properties": {
        "mode": { "$ref": "#/$defs/normalization_mode" },
        "exclude_qc_flagged": { "type": "boolean" },
        "reference_band_ids": {
          "type": "array",
          "items": { "type": "string", "minLength": 1 }
        },
        "reference_designation_source": {
          "type": "string",
          "minLength": 1,
          "description": "Where the reference-band designation in reference_band_ids came from: a ground-truth field, a figure caption a human read, a designation table and its confirmation state. Free text, recorded verbatim and never parsed by the pipeline -- it describes a designation and can never supply one. Present only alongside reference_band_ids: a source with nothing designated would be a provenance record about nothing. Absent means the designation's origin was not stated, which is not the same as its being unsourced, and a consumer must not read absence as confirmation."
        },
        "warnings": {
          "type": "array",
          "items": { "$ref": "#/$defs/normalization_warning" },
          "description": "housekeeping_single always emits single_housekeeping_reference, per current journal guidance. lane_without_reference_band says at least one lane had no designated reference, and lane_denominator_not_positive that at least one lane's denominator measured zero or negative; in both cases that lane produces no ratios and every band in it is recorded as excluded with the reason, rather than being normalized against a guess."
        },
        "ratios": {
          "type": "array",
          "items": {
            "type": "object",
            "additionalProperties": false,
            "required": ["lane_id", "numerator_band_id", "ratio", "excluded"],
            "properties": {
              "lane_id": { "type": "string", "minLength": 1 },
              "numerator_band_id": { "type": "string", "minLength": 1 },
              "denominator_band_id": {
                "type": "string",
                "minLength": 1,
                "description": "Present when the lane was divided by exactly one reference band."
              },
              "denominator_band_ids": {
                "type": "array",
                "minItems": 1,
                "uniqueItems": true,
                "items": { "type": "string", "minLength": 1 },
                "description": "Every reference band this lane was divided by: one under housekeeping_single, several under housekeeping_multi (their geometric mean), absent under total_protein, whose denominator is the lane integral rather than a band."
              },
              "ratio": { "type": "number" },
              "excluded": { "type": "boolean" },
              "exclusion_reason": { "type": "string", "minLength": 1 },
              "qc_flags": {
                "$ref": "#/$defs/band_qc_flags",
                "description": "Every band flag carried by any band entering this ratio -- the numerator and the reference(s)."
              },
              "reference_qc_flagged": {
                "type": "boolean",
                "description": "Whether this ratio's denominator carries a QC flag. A flagged reference is normalized against and warned about rather than dropped, so this is recorded per lane and a consumer can filter on it without re-deriving the condition."
              },
              "reference_qc_flags": {
                "$ref": "#/$defs/band_qc_flags",
                "description": "The flags the denominator carries: the reference band's under a housekeeping mode, or those of every band in the lane under total_protein, since the lane integral contains them all. Note the consequence under total_protein: the numerator band is itself part of the lane integral, so its own flags appear here too, and this field therefore does not distinguish 'the denominator is independently compromised' from 'this band is flagged'. Compare it with the band's own qc_flags to tell the two apart."
              }
            },
            "allOf": [
              {
                "if": { "properties": { "excluded": { "const": true } } },
                "then": { "required": ["exclusion_reason"] }
              }
            ]
          }
        }
      }
    },
    "image_qc_flags": {
      "type": "array",
      "uniqueItems": true,
      "items": { "$ref": "#/$defs/image_qc_flag" }
    },
    "methods_paragraph": {
      "type": "string",
      "description": "Generated from provenance (Phase 5)."
    }
  },
  "$defs": {
    "sha256": { "type": "string", "pattern": "^sha256:[0-9a-f]{64}$" },
    "roi": {
      "type": "object",
      "additionalProperties": false,
      "required": ["x", "y", "width", "height"],
      "properties": {
        "x": { "type": "integer", "minimum": 0 },
        "y": { "type": "integer", "minimum": 0 },
        "width": { "type": "integer", "minimum": 1 },
        "height": { "type": "integer", "minimum": 1 }
      }
    },
    "band_qc_flags": {
      "type": "array",
      "uniqueItems": true,
      "items": { "enum": ["saturated", "overlapping", "unresolved_shoulder"] },
      "description": "`saturated` and `overlapping` share the ground-truth vocabulary, so evals score them directly. `unresolved_shoulder` has no ground-truth counterpart: it is a test on the row profile's shape, where `overlapping` is a test on ROI geometry, and the two are named and scored separately rather than one standing in for the other. It never implies a second band, a second centre or a second ROI."
    },
    "image_qc_flag": { "enum": ["saturated", "lossy_format", "low_dynamic_range"] },
    "normalization_mode": {
      "enum": ["housekeeping_single", "housekeeping_multi", "total_protein"]
    },
    "normalization_warning": {
      "description": "`reference_band_qc_flagged` is kept as the general code and is emitted alongside the specific one, so a consumer written against version 1.0.0 still works. The specific codes exist because the caveats differ in direction: a saturated reference under-reads, so every ratio in its lane is biased upward by a known sign, while an overlapping or shouldered one is biased in an unknown direction. `reference_band_lossy_format` is the one code that is not about a band flag -- it says the denominator was measured on pixels a lossy codec rewrote -- and it is therefore never present in any band's or ratio's qc_flags.",
      "enum": [
        "single_housekeeping_reference",
        "reference_band_qc_flagged",
        "reference_band_saturated",
        "reference_band_overlapping",
        "reference_band_unresolved_shoulder",
        "reference_band_lossy_format",
        "qc_flagged_bands_included_by_override",
        "lane_without_reference_band",
        "lane_denominator_not_positive"
      ]
    }
  }
}
