{
  "schema_version": "1.4.0",
  "result_id": "3befd12e4b8d8cde",
  "source": {
    "path": "/var/folders/mw/47r46fnd1l5gwltvp7s3b23m0000gn/T/blotquant-upload-t8lusmbr/PMC13135410_Figure3__B-Fib-CCN2-GAPDH.png",
    "sha256": "sha256:84eb5498f0b57c6567a7ae7267449d2a3cf3ae4f5ac0a5bc9c3f85ec7da2aeb0",
    "image_format": "png",
    "bit_depth": 8,
    "max_value": 255,
    "width_px": 422,
    "height_px": 139,
    "lossy_format": false,
    "polarity": "dark_on_bright",
    "channel_collapse": {
      "method": "green",
      "max_divergence_dn": 0
    }
  },
  "provenance": {
    "software_version": "0.1.0",
    "config_id": "default",
    "config_digest": "sha256:f9db0bd62d0ace61c24136a8aae819ac400723aeb2b5ea44d6b9bfe192bd187d",
    "created_at": "2026-09-04T14:26:59Z",
    "parameters": {
      "background": {
        "method": "local_median",
        "window_px": 51
      },
      "detection": {
        "method": "profile_projection",
        "profile_smoothing_px": 5,
        "lane": {
          "min_separation_px": 12,
          "min_prominence_fraction": 0.4,
          "robust_range_percentile": 10.0,
          "extent_relative_height": 0.06,
          "extent_min_sigma": 2.0
        },
        "band": {
          "min_separation_px": 1,
          "min_prominence_fraction": 0.3,
          "min_prominence_sigma": 5.0,
          "baseline_percentile": 10.0,
          "extent_relative_height": 0.06,
          "extent_min_sigma": 2.0
        }
      },
      "quantification": {
        "method": "roi_sum",
        "clamp_negative_pixels": false
      },
      "qc": {
        "saturated_min_clipped_pixels": 1,
        "overlap_iou_threshold": 0.05,
        "shoulder_half_maximum_fraction": 0.5,
        "shoulder_half_width_ratio": 1.5,
        "dynamic_range_min_peak_fraction": 0.25
      },
      "normalization": {
        "mode": "total_protein",
        "exclude_qc_flagged": true
      }
    }
  },
  "lanes": [
    {
      "lane_id": "L0",
      "lane_index": 0,
      "roi": {
        "x": 300,
        "y": 0,
        "width": 30,
        "height": 139
      },
      "roi_source": "caller",
      "total_protein_signal": 71621.0
    }
  ],
  "bands": [
    {
      "band_id": "L0_B0",
      "lane_id": "L0",
      "roi": {
        "x": 300,
        "y": 1,
        "width": 21,
        "height": 26
      },
      "integrated_intensity": 12108.0,
      "background_estimate": 0.056776556776556776,
      "peak_value": 209.0,
      "clipped_pixel_count": 0,
      "row_half_width_ratio": 1.247809402110578,
      "qc_flags": [],
      "excluded_from_normalization": false
    },
    {
      "band_id": "L0_B1",
      "lane_id": "L0",
      "roi": {
        "x": 309,
        "y": 26,
        "width": 21,
        "height": 18
      },
      "integrated_intensity": 6645.0,
      "background_estimate": 10.66931216931217,
      "peak_value": 199.0,
      "clipped_pixel_count": 0,
      "row_half_width_ratio": 1.036944146839124,
      "qc_flags": [
        "overlapping"
      ],
      "excluded_from_normalization": true,
      "exclusion_reason": "carries QC flags: overlapping"
    },
    {
      "band_id": "L0_B2",
      "lane_id": "L0",
      "roi": {
        "x": 300,
        "y": 40,
        "width": 24,
        "height": 16
      },
      "integrated_intensity": 18394.0,
      "background_estimate": 30.627604166666668,
      "peak_value": 225.0,
      "clipped_pixel_count": 1,
      "row_half_width_ratio": 1.1589025498853596,
      "qc_flags": [
        "saturated",
        "overlapping"
      ],
      "excluded_from_normalization": true,
      "exclusion_reason": "carries QC flags: saturated, overlapping"
    },
    {
      "band_id": "L0_B3",
      "lane_id": "L0",
      "roi": {
        "x": 304,
        "y": 63,
        "width": 26,
        "height": 5
      },
      "integrated_intensity": 3856.0,
      "background_estimate": 51.36923076923077,
      "peak_value": 121.0,
      "clipped_pixel_count": 0,
      "row_half_width_ratio": 2.2834250522998265,
      "qc_flags": [
        "unresolved_shoulder"
      ],
      "excluded_from_normalization": true,
      "exclusion_reason": "carries QC flags: unresolved_shoulder"
    },
    {
      "band_id": "L0_B4",
      "lane_id": "L0",
      "roi": {
        "x": 304,
        "y": 73,
        "width": 24,
        "height": 13
      },
      "integrated_intensity": 8949.0,
      "background_estimate": 59.5,
      "peak_value": 68.0,
      "clipped_pixel_count": 0,
      "row_half_width_ratio": 2.100478940201888,
      "qc_flags": [
        "unresolved_shoulder"
      ],
      "excluded_from_normalization": true,
      "exclusion_reason": "carries QC flags: unresolved_shoulder"
    },
    {
      "band_id": "L0_B5",
      "lane_id": "L0",
      "roi": {
        "x": 302,
        "y": 100,
        "width": 22,
        "height": 35
      },
      "integrated_intensity": 31458.0,
      "background_estimate": 32.36493506493507,
      "peak_value": 189.0,
      "clipped_pixel_count": 0,
      "row_half_width_ratio": 1.2622148058844886,
      "qc_flags": [],
      "excluded_from_normalization": false
    }
  ],
  "normalization": {
    "mode": "total_protein",
    "exclude_qc_flagged": true,
    "warnings": [
      "reference_band_qc_flagged",
      "reference_band_saturated",
      "reference_band_overlapping",
      "reference_band_unresolved_shoulder"
    ],
    "ratios": [
      {
        "lane_id": "L0",
        "numerator_band_id": "L0_B0",
        "ratio": 0.16905656162298768,
        "excluded": false,
        "qc_flags": [
          "saturated",
          "overlapping",
          "unresolved_shoulder"
        ],
        "reference_qc_flagged": true,
        "reference_qc_flags": [
          "saturated",
          "overlapping",
          "unresolved_shoulder"
        ]
      },
      {
        "lane_id": "L0",
        "numerator_band_id": "L0_B1",
        "ratio": 0.09278005054383491,
        "excluded": true,
        "exclusion_reason": "carries QC flags: overlapping",
        "qc_flags": [
          "saturated",
          "overlapping",
          "unresolved_shoulder"
        ],
        "reference_qc_flagged": true,
        "reference_qc_flags": [
          "saturated",
          "overlapping",
          "unresolved_shoulder"
        ]
      },
      {
        "lane_id": "L0",
        "numerator_band_id": "L0_B2",
        "ratio": 0.25682411583194875,
        "excluded": true,
        "exclusion_reason": "carries QC flags: saturated, overlapping",
        "qc_flags": [
          "saturated",
          "overlapping",
          "unresolved_shoulder"
        ],
        "reference_qc_flagged": true,
        "reference_qc_flags": [
          "saturated",
          "overlapping",
          "unresolved_shoulder"
        ]
      },
      {
        "lane_id": "L0",
        "numerator_band_id": "L0_B3",
        "ratio": 0.053838957847558676,
        "excluded": true,
        "exclusion_reason": "carries QC flags: unresolved_shoulder",
        "qc_flags": [
          "saturated",
          "overlapping",
          "unresolved_shoulder"
        ],
        "reference_qc_flagged": true,
        "reference_qc_flags": [
          "saturated",
          "overlapping",
          "unresolved_shoulder"
        ]
      },
      {
        "lane_id": "L0",
        "numerator_band_id": "L0_B4",
        "ratio": 0.12494938635316458,
        "excluded": true,
        "exclusion_reason": "carries QC flags: unresolved_shoulder",
        "qc_flags": [
          "saturated",
          "overlapping",
          "unresolved_shoulder"
        ],
        "reference_qc_flagged": true,
        "reference_qc_flags": [
          "saturated",
          "overlapping",
          "unresolved_shoulder"
        ]
      },
      {
        "lane_id": "L0",
        "numerator_band_id": "L0_B5",
        "ratio": 0.4392287178341548,
        "excluded": false,
        "qc_flags": [
          "saturated",
          "overlapping",
          "unresolved_shoulder"
        ],
        "reference_qc_flagged": true,
        "reference_qc_flags": [
          "saturated",
          "overlapping",
          "unresolved_shoulder"
        ]
      }
    ]
  },
  "image_qc_flags": [
    "saturated"
  ]
}
