{
  "schema_version": "1.4.0",
  "result_id": "5c68fe1a8f447b2a",
  "source": {
    "path": "/var/folders/mw/47r46fnd1l5gwltvp7s3b23m0000gn/T/blotquant-upload-hg_7t957/PMC13135410_Figure4__C-PDGFRa-GAPDH.png",
    "sha256": "sha256:7d03960e8b03ee37631e2d81cedb519cdf6114b2a2c2f47aedf347a0bdcebce5",
    "image_format": "png",
    "bit_depth": 8,
    "max_value": 255,
    "width_px": 489,
    "height_px": 122,
    "lossy_format": false,
    "polarity": "dark_on_bright",
    "channel_collapse": {
      "method": "green",
      "max_divergence_dn": 0
    }
  },
  "provenance": {
    "software_version": "0.1.0",
    "config_id": "default",
    "config_digest": "sha256:f9db0bd62d0ace61c24136a8aae819ac400723aeb2b5ea44d6b9bfe192bd187d",
    "created_at": "2026-09-04T14:27:00Z",
    "parameters": {
      "background": {
        "method": "local_median",
        "window_px": 51
      },
      "detection": {
        "method": "profile_projection",
        "profile_smoothing_px": 5,
        "lane": {
          "min_separation_px": 12,
          "min_prominence_fraction": 0.4,
          "robust_range_percentile": 10.0,
          "extent_relative_height": 0.06,
          "extent_min_sigma": 2.0
        },
        "band": {
          "min_separation_px": 1,
          "min_prominence_fraction": 0.3,
          "min_prominence_sigma": 5.0,
          "baseline_percentile": 10.0,
          "extent_relative_height": 0.06,
          "extent_min_sigma": 2.0
        }
      },
      "quantification": {
        "method": "roi_sum",
        "clamp_negative_pixels": false
      },
      "qc": {
        "saturated_min_clipped_pixels": 1,
        "overlap_iou_threshold": 0.05,
        "shoulder_half_maximum_fraction": 0.5,
        "shoulder_half_width_ratio": 1.5,
        "dynamic_range_min_peak_fraction": 0.25
      },
      "normalization": {
        "mode": "total_protein",
        "exclude_qc_flagged": true
      }
    }
  },
  "lanes": [
    {
      "lane_id": "L0",
      "lane_index": 0,
      "roi": {
        "x": 272,
        "y": 0,
        "width": 36,
        "height": 122
      },
      "roi_source": "caller",
      "total_protein_signal": 104620.0
    }
  ],
  "bands": [
    {
      "band_id": "L0_B0",
      "lane_id": "L0",
      "roi": {
        "x": 281,
        "y": 35,
        "width": 1,
        "height": 11
      },
      "integrated_intensity": 1166.0,
      "background_estimate": 6.545454545454546,
      "peak_value": 180.0,
      "clipped_pixel_count": 0,
      "row_half_width_ratio": 1.2606978403678557,
      "qc_flags": [],
      "excluded_from_normalization": false
    },
    {
      "band_id": "L0_B1",
      "lane_id": "L0",
      "roi": {
        "x": 283,
        "y": 48,
        "width": 25,
        "height": 27
      },
      "integrated_intensity": 29706.0,
      "background_estimate": 37.217777777777776,
      "peak_value": 195.0,
      "clipped_pixel_count": 0,
      "row_half_width_ratio": 1.1062812725154745,
      "qc_flags": [],
      "excluded_from_normalization": false
    },
    {
      "band_id": "L0_B2",
      "lane_id": "L0",
      "roi": {
        "x": 275,
        "y": 84,
        "width": 29,
        "height": 13
      },
      "integrated_intensity": 31767.0,
      "background_estimate": 24.73209549071618,
      "peak_value": 192.0,
      "clipped_pixel_count": 0,
      "row_half_width_ratio": 1.3657647578659629,
      "qc_flags": [],
      "excluded_from_normalization": false
    }
  ],
  "normalization": {
    "mode": "total_protein",
    "exclude_qc_flagged": true,
    "warnings": [],
    "ratios": [
      {
        "lane_id": "L0",
        "numerator_band_id": "L0_B0",
        "ratio": 0.011145096539858537,
        "excluded": false,
        "qc_flags": [],
        "reference_qc_flagged": false,
        "reference_qc_flags": []
      },
      {
        "lane_id": "L0",
        "numerator_band_id": "L0_B1",
        "ratio": 0.2839418849168419,
        "excluded": false,
        "qc_flags": [],
        "reference_qc_flagged": false,
        "reference_qc_flags": []
      },
      {
        "lane_id": "L0",
        "numerator_band_id": "L0_B2",
        "ratio": 0.3036417510992162,
        "excluded": false,
        "qc_flags": [],
        "reference_qc_flagged": false,
        "reference_qc_flags": []
      }
    ]
  },
  "image_qc_flags": []
}
